<?xml version="1.0" encoding="UTF-8"?>
<!DOCTYPE persons [
    <!ELEMENT lastname (#PCDATA)>
    <!ELEMENT firstname (#PCDATA)>
    <!ELEMENT residence (#PCDATA)>
    <!ELEMENT children (person*)>
    <!ELEMENT person (firstname, (lastname?), (children*), (residence?))>
    <!ELEMENT persons (person+)>
    <!ATTLIST person id ID #REQUIRED>
    <!ATTLIST person friends IDREFS #IMPLIED>
	<!ATTLIST persons file CDATA #IMPLIED>
    ]>
<?mach was draus?>
<persons file="this">
    <!-- Hier beginnen die Daten -->
    <person id="p-2">
        <firstname>Pu</firstname>
        <lastname>Bär</lastname>
    </person>
    <person id="p-1">
        <firstname>Christopher</firstname>
        <lastname>Robin</lastname>
    </person>
    <person id="p-3">
        <firstname>Eule</firstname>
        <residence>Hundertsechzig-Morgen-Wald</residence>
    </person>
    <person id="p-4">
        <firstname>I-Ah</firstname>
        <children>
            <person id="p-9" >
                <firstname>1. Kind</firstname>
                <!-- Kommentar bei Klein Ruh -->
                <residence>Bei Kängah</residence>
            </person>
        </children>
        <children>
            <person id="p-10" >
                <firstname>2. Kind</firstname>
                <!-- Kommentar bei Klein Ruh -->
                <residence>Bei Kängah</residence>
            </person>
        </children>     
    </person>
    <person id="p-5">
        <firstname>Kängah</firstname>
        <children>
            <person id="p-6" friends=" p-1 p-7 ">
                <firstname>Klein Ruh</firstname>
                <!-- Kommentar bei Klein Ruh -->
                <residence>Bei Kängah</residence>
            </person>
        </children>
        <residence>Bei Kängah</residence>
        <!-- zusätzlich -->
    </person>
    <person id="p-7">
        <firstname>Tigger</firstname>
        <children>
            <person id="p-11" friends="p-1">
                <firstname>3. Kind</firstname>
                <children>
                    <person id="p-14" friends=" p-1 p-7 ">
                        <firstname>Kind von 3. Kind</firstname>
                        <!-- Kommentar bei Klein Ruh -->
                        <residence>Bei Kängah</residence>
                    </person>
                </children>
                <!-- Kommentar bei Klein Ruh -->
                <residence>Carla</residence>
            </person>
        </children>
        <children>
            <person id="p-12" friends="p-1">
                <firstname>4. Kind</firstname>
                <!-- Kommentar bei Klein Ruh -->
                <residence>Bernd</residence>
            </person>
        </children>
        <residence>Bei Kängah</residence> 
    </person>
    <person id="p-8" friends="p-1">
        <firstname>Ferkel<!-- Kommentar bei Ferkel--></firstname>
    </person>
    <!-- Kommentar zum Schluss -->
    <?tu was damit?>
</persons>
